id|setup|punchline
1|¿Por qué los programadores confunden Halloween con Navidad?|Porque Oct 31 == Dec 25.
2|¿Qué es un terapeuta?|1024 gigapeutas.
3|¿Por qué los programadores prefieren el modo oscuro?|Porque la luz atrae bugs.
4|¿Cuál es el animal más antiguo?|La cebra, porque está en blanco y negro.
5|¿Por qué Java y JavaScript se llevan mal?|Porque uno tiene clase y el otro no.
6|Un SELECT entra a un bar, se acerca a dos mesas y pregunta...|¿Puedo unirme?
7|¿Qué le dice un bit al otro?|Nos vemos en el bus.
8|¿Por qué los programadores odian la naturaleza?|Porque tiene muchos bugs.
9|Hay 10 tipos de personas en el mundo|Los que entienden binario y los que no.
10|¿Cuál es el colmo de un programador?|Que su esposa le diga que no tiene clase.
11|¿El otorrino va por número?|Van nombrando. Qué gran actor, pero no me cambie de tema.
12|¿Por qué las mujeres de Lepe beben agua del mar?|Para ser más saladas.
13|¿Qué le dice un jardinero a otro?|Nos vemos cuando podamos.
14|¿Cuál es la mayor exportación de Australia?|Los boomerangs. También son la mayor importación.
15|¿Cómo se llama un boomerang que no vuelve?|Palo.
16|Intenté organizar un torneo profesional de escondite|Pero fue un completo fracaso. Los buenos jugadores son difíciles de encontrar.
17|El otro día vendí mi aspiradora|Lo único que hacía era acumular polvo.
18|¿Qué es rojo y tiene forma de cubo?|Un cubo azul pintado de rojo.
19|Van dos ciegos y le dice uno al otro|Ojalá lloviera. Ojalá yo también.
20|¿Mira, tronco, una piedra preciosa?|Pero si es un ladrillo. Pues a mí me gusta.
21|Había un tipo que era tan borrachín que le llamaban genio|Porque cada vez que destapaban una botella aparecía.
22|Dos vascos a la salida de un examen de matemáticas|Oye, Iñaki, ¿a ti que te dio el segundo problema? ¿A mí? Infinito. ¿Solo?
23|Ramón, si supieras que voy a morir mañana|¿Me prestas mil euros y mañana te los devuelvo?
24|Un chiste comunista no tiene gracia|Si no lo entiende todo el mundo.
25|¿Qué le dijo Batman a Robin antes de subir al coche?|Robin, sube al coche.
26|Tengo un amigo otaku que estaba triste|Así que lo animé.
27|Van dos fantasmas y se cae el del médium|¿Dónde estará?
28|¿Sabes cómo se llaman los habitantes de Nueva York?|Hombre, pues todos no.
29|¿Tienen libros para el cansancio?|Sí, pero están agotados.
30|¿Qué es rojo y malo para tus dientes?|Un ladrillo.
31|¿Has oído hablar del astronauta claustrofóbico?|Solo necesitaba un poco de espacio.
32|¿Te gusta el rock progresivo?|Cada vez más.
33|Soy paraguayo y quiero pedirle la mano de su hija para casarme|¿Para qué? Paraguayo.
34|¿Cómo se despiden los químicos?|Ácido un placer.
35|¿Cuánto cuesta alquilar este coche?|Depende del tiempo. Vale, pongamos que llueve...
36|¿Cómo se llama el campeón de buceo japonés?|Tokofondo.
37|A mí me gustaría vivir en una isla desierta|A mí también. ¡Caray! ¡Ya empezamos a llenarla!
38|Iba a contar un chiste sobre sodio|Pero Na.
39|Conocí a mi novia en un ascensor|Dice que soy el amor de subida.
40|¿Qué pasa si se va la luz en una escuela privada?|Que no se ve ni un pijo.
41|¿Dónde está la sección de libros sobre el sentido del gusto?|Lo siento, sobre gustos no hay nada escrito.
42|Ha cometido usted un crimen matemático|Pues lo asumo. Pues lo arresto.
43|¿Dónde has estado, Ramón?|En una clínica donde te quitan las ganas de fumar. ¡Pero si estás fumando! Ya… pero sin ganas.
44|Doctor, dígame la verdad, ¿tengo problemas de memoria?|¡Que sí!
45|¿Por qué los chistes de rubias son tan cortos?|Para que los hombres puedan recordarlos.
46|¿Te sabes el chiste del electricista?|No. Pues tiene mucha chispa.
47|Hombre, Pepe, cómo has cambiado|Yo no soy Pepe. Pues más a mi favor.
48|¡Capitán, capitán! Están a punto de atacarnos 40 carabelas|¿Una flota? No, flotan todas.
49|¿Sabes? Hoy me he comprado una paloma que cuesta diez mil euros|¿Mensajera? No no, no te exagero nada.
50|¿Qué hay peor que encontrarse un gusano en una manzana?|Encontrarse medio.
51|¿De dónde sale la porcelana?|De las porceovejas.
52|Me gustan los elefantes|Todo lo demás me parece irrelefante.
53|¿Por qué no pueden hablar los dinosaurios?|Porque están muertos.
54|¿Cuál es el animal más tonto de la selva?|El oso polar.
55|¿Qué pasa si tiras un pato al agua?|Nada.
56|¿Qué le dice un gusano a otro?|Me voy a dar la vuelta a la manzana.
57|¿Cuáles eran los personajes de dibujos animados favoritos del capitán del Titanic?|Timón y Pumba.
58|¿Hola, Conchita?|No, con Tarzán.
59|¿Qué hace una abeja en un gimnasio?|Zumba.
60|¡Me acaba de picar una serpiente!|¿Cobra? No, gratis.
61|¿Qué le dice un ganso a una gansa?|¡Vengansa!
62|Si se muere una pulga, ¿dónde va?|Al pulgatorio.
63|¿Qué es un pez en un cine?|Un mero espectador.
64|¿Por qué la gallina cuida tanto a sus pollitos?|Porque le costó un huevo tenerlos.
65|¿Qué hace un pez mago?|Nada por aquí, nada por allá.
66|¿Qué le dice la foca a su madre?|I love you, mother foca.
67|¿Cuál es el colmo de un carnicero?|Tener un perro salchicha y un hijo chuleta.
68|Jaimito, ¿cuánto es 2 x 2?|Empate. ¿Y 2 x 1? ¡Oferta!
69|Jaimito, sal del coche y mira si funciona el intermitente|Ahora sí, ahora no, ahora sí, ahora no...
70|¿Dónde vas, Jaimito?|A por estiércol para las fresas. ¿Pero por qué no te las comes con nata?
71|Jaimito, ¿cuál es la definición de telepatía?|Un aparato de televisión para la hermana de mi mamá.
72|Jaimito, ¿qué has aprendido hoy en clase?|Pues no lo suficiente mamá, ya que tengo que volver a ir mañana.
73|Papá, ¿regañarías a un niño que no haya hecho nada?|Por supuesto que no. Pues menos mal, ¡porque hoy no he hecho los deberes!
74|Jaimito, dime 5 animales de África|Cinco elefantes, profesora.
75|Mamá, ¿puedo usar tu coche?|¡No sin mi supervisión, Jaimito! ¡Perdón por no tener superpoderes como tú!
76|Jaimito, ¿quién fue Juana de Arco?|Una drogadicta, seño. ¿De dónde sacas eso? Mi libro dice que murió por heroína.
77|Mamá, tengo una noticia buena y otra mala|La buena es que ¡he aprobado todas las asignaturas! ¿Y la mala? ¡Que es mentira!
78|Jaimito, ¿qué harías si te estuvieras ahogando en alta mar?|¡Llorar para desahogarme!
79|¿Cuántas anclas tiene un barco, Jaimito?|Once, profesora. ¿Y por qué once? Porque siempre oigo que dicen: eleven anclas.
80|¿Cuánto llevas ahorrado ya, Jaimito?|Ceromil cerocientos cerocero euros.
81|Mamá, hoy en el colegio hemos aprendido a hacer explosivos|¿Y mañana qué aprenderéis? ¿Qué colegio?
82|Jaimito, dame al bebé|Espera a que llore. ¿A que llore por qué? Porque no sé dónde lo dejé.
83|El dentista le dice a Jaimito: ¿Quieres que te duerma las muelas?|Bueno, con tal de que se despierten para la cena.
84|Jaimito, tienes que decir dos palabras que tengan tilde|¡Pues muy sencillo, Matilde y Clotilde!
85|Jaimito, ¿por qué en invierno los días son más cortos?|Porque el calor expande las cosas y el frío las contrae.
86|Jaimito, ¿cuál es el masculino de oca?|Parchís.
87|Mira, Jaimito, la Luna está llena|¿De qué?
88|Jaimito, ¿sabes inglés?|Yes. Traduce: Me gusta ir al gimnasio a tonificarme. I like gin tonic.
89|Jaimito, ¿qué haces pintándote la cara de azul?|Porque mi novia se ha ido lejos y ¡yo quiero estar a zu lado!
90|Jaimito, me han dicho que eres muy rápido en matemáticas. ¿Cuánto es 55 por 239?|¡129! ¡Pero si ni siquiera te has acercado! Ya, pero no me diga que no he sido rápido.
91|Jaimito, conjuga el verbo andar|Yo ando, tú andas. ¡Más deprisa! Él corre, nosotros corremos, ellos corren.
92|Jaimito, dime una palabra que tenga muchas les|¡Muy fácil, seño! ¡GOOOOOOOOOL!
93|Jaimito, ¿qué planeta va detrás de Marte?|Miércoles.
94|En clase le preguntan a Jaimito: ¿De qué signo es tu madre?|Pues debe de ser de exclamación porque se pasa todo el día gritándome.
95|¡Profe, me recuerdas al mar!|¡Ay, Jaimito, qué cosas tienes! ¿Por qué lo dices? ¡Porque me mareas!
96|Jaimito, ¿tú sabes lo que es el estudio?|Sí, mamá, el alimento de la mente. ¡Exacto! Pero es que resulta que hoy estoy a dieta.
97|¿Qué le dice un techo a otro?|Techo de menos.
98|Doctor, soy asmático, ¿es grave?|No, es esdrújula.
99|Si los zombis se degradan con el paso del tiempo|¿Zombiodegradables?
100|En Hawái no te hospedan|Te alohan.
101|¿Cuál es el colmo de un jardinero?|Que siempre le dejen plantado.
102|Mustafá, ¿quieres comer algo?|¿Es Halal? Mustafá, ¿quieres jalal algo?
103|¿Cómo se llama el hermano enfermo de Hello Kitty?|Bron Kitty.
104|Soy celíaca|Encantado, yo Antoniaco.
105|Hay tres tipos de personas en el mundo|Los que saben contar y los que no.
106|¿Eres un fanático de la informática, verdad?|Sí... mouse o menos.
107|¿Cómo se llama el hermano vegetariano de Bruce Lee?|Broco Lee.
108|¿Qué le dice un 2 a un 0?|Veinte conmigo, guapetón.
109|Mi nuevo diccionario es malísimo|No solo eso, también es malísimo.
110|Ayer fui al McDonald's con cuatro amigos. Tres eran de sagitario|¿Y el cuarto? De libra.
111|¿Qué son 50 físicos y 50 químicos juntos?|100tíficos.
112|¿Cuál es el café más peligroso del mundo?|El ex-preso.
113|Ayer llamé a la policía porque unos ladrones robaron en mi casa|Se llevaron hasta los vasos. ¿Y los detuvo? Sí, sí, los de tubo también.
114|En una entrevista de trabajo: Habla inglés, según su currículum|Oui. Eso es francés. Pues apúntemelo también.
115|Se abre el telón y se ve un tetrabrik de Don Simón|¿Cómo se llama la película? Es tinto básico.
116|Cariño, ¿dónde están los niños?|¡En inglés! Darling, where are the kids!?
117|¿Cómo se declara el acusado?|Con flores, soy bastante tradicional.
118|Mi capitán, ¿puedo desembarcar por la izquierda?|Se dice por babor. Por babor, mi capitán, ¿puedo desembarcar por la izquierda?
119|Servicio de atención al cliente, ¿cuál es el motivo de su llamada?|¡Una devolución! ¡NEDEDITO ADMAS!
120|¿Usted está empadronado?|No, qué va, es mi carácter.
121|¿Cómo se llaman los elefantes expertos en problemas de la piel?|Paquidermatólogos.
122|¿Por qué siempre hay que llevar casco cuando se va en moto?|Porque es funda-mental.
123|Camarero, para mi mujer una pizza compleja|¿Una capricciosa? Hasta los huevos, me tiene, oiga.
124|¿Es la embajada de Laos?|Sí. Pues mándenme uno de pistacho.
125|¡Menuda fortuna hizo Henry Ford con los coches!|Pues anda que su hermano Roque con los quesos.
126|¡Abordar el barco!|Y el barco quedó precioso.
127|¡Paco, la lavadora se ha calcificado!|¡¿Para la final?!
128|Cariño, ¿has visto mi crema reafirmante?|¡Sí, sí, sí, sí, sí y sí!
129|¿Domina usted el inglés?|Hombre, si es bajito y se deja.
130|¿Tienen alpargatas?|¡Muy buenas! Muy buenas, ¿tienen alpargatas?
131|Entonces, doctor, ¿con este condón de lana se curará mi impotencia?|No, pero le sudará la polla.
132|¡Tráeme una naranja, Pepi!|¿Te la pelo? ¡Vale! Y la naranja para después.
133|Conchi, te la voy a meter hasta el fondo|Joder Ramón, qué poco romántico eres. A la luz de la luna, te la voy a meter hasta el fondo.
134|El otro día tu mujer me contó un chiste|Tan bueno que de la risa me caí de la cama.
135|El marido se acuesta y le susurra a su mujer|Estoy sin calzoncillos. Mañana te lavo unos.
136|Doctor, Doctor, padezco de eyaculación precoz|¡Coño! Ahhhg...
137|Un gintonic, por favor. ¿Le pongo pepino?|Desde el primer día que la vi, señorita...
138|¿En qué se parece la mujer a una ficha de parchís?|En que se corren con el dedo.
139|La mujer le dice al marido: En la tele hay una corrida|¿Quieres que la grabe? No, que la limpies.
140|Tengo el pene como el estadio de fútbol del Valencia|¿De largo? No, ¡MESTALLA!
141|¡Doctor, doctor, tengo un hueso fuera!|Hágalo pasar, por favor.
142|Papá, ¿qué está más lejos, Córdoba o la Luna?|¿Tú ves desde aquí Córdoba? No. Pues eso.
143|¡Camarero! Este filete tiene muchos nervios|Normal, es que es la primera vez que se lo comen.
144|¡Estás obsesionado con la comida!|No sé a qué te refieres croquetamente.
145|¿Sabes cómo se queda un mago después de comer?|Magordito.
146|Mamá, el abuelo está malo|Pues apártalo y cómete solo las patatas.
147|Parece que su tos está mejor|Sí, estuve practicando toda la noche.
148|¿Para qué va una caja al gimnasio?|Para hacerse caja fuerte.
149|¿Qué le dice una iguana a otra?|Somos iguanitas.
150|¿Cuál es tu plato favorito?|Pues el hondo, porque cabe más comida.
151|¿Sabes cuánto pago de alquiler por la frutería?|¿Cuánto? Pimientos euros.
152|A las 10 te pito y bajas|¿Te has comprado un coche? No, un pito.
153|Había una vez un chiste tan malo|Que pegaba a los otros chistes.
154|¿Qué le dice una barra de pan a otra?|Te presento a una miga.
155|¿Te sabes el chiste del autobús?|No. Suele pasar.
156|¿Cómo se llama la hija de Thor?|La thorrija.
157|Me da un café con leche corto|Se me ha roto la máquina, cambio.
158|¿Dónde cuelga Superman su supercapa?|En superchero.
159|¿Y cuál es la colonia de Superman?|Pues superfume.
160|Un hombre entra en un bar de pinchos y dice|Ay, ay, ay, ay.
161|¿Qué le dice un huevo a una sartén?|Me tienes frito.
162|¿Cuál es la montaña más limpia?|El volcán. Porque primero echa cenizas y después, lava.
163|Pepito, si en esta mano tengo 8 naranjas y en esta otra 6|¡Unas manos enormes, profe!
164|¿Qué le dice un pollito a su enemigo?|¡Caldito seas!
165|¿Qué le dijo una pulga a otra pulga?|¿Vamos a pie o esperamos al perro?
166|¿Qué le dice una pared a otra?|¡Nos vemos en la esquina!
167|¿Por qué llora un libro de matemáticas?|¡Porque tiene muchos problemas!
168|¿Está Agustín?|No, estoy incomodín.
169|¿Qué está al final de todo?|¡La letra o!
170|¿Por qué el profe de música tiene una escalera?|¡Para poder llegar a las notas más altas!
171|¿Cuál es el baile favorito del tomate?|¡La salsa!
172|¿Qué le dice un pez a otro?|¡Nada!
173|¿Cuál es el colmo de un futbolista?|¡Que le hagan la pelota!
174|¿Qué le dice un semáforo a otro?|¡No me mires, que me estoy cambiando!
175|Se sube un señor al autobús y pregunta: ¿Cuánto vale el bus?|Un euro. Pues que se bajen todos, que me lo quedo.
176|Estaba una pizza llorando en el cementerio|Llega otra pizza y le dice: ¿Era familiar? No, mediana.
177|Mi capitán, hemos perdido la batalla|¡Pues buscadla inmediatamente!
178|Mamá, ¿me haces un bocadillo de jamón?|¿York? Sí, turk.
179|Doctor, ¡tengo paperas!|Pues tome estos 2 euros y ya tienes pa plátanos.
180|¿Qué le dice una taza a otra?|¿Qué taza ciendo?
181|¡Profe, profe, mi boli no escribe!|Pues dale aliento. ¡Vamos boli, tú puedes!
182|¿Cómo se dice perro en inglés?|Dog. ¿Y veterinario? Dog-tor.
183|Una tortuga y una liebre apuestan a ver quién llega antes|Ganó tortuga, porque el caparazón es su casa.
184|¿Cuál es el animal que tiene más dientes?|¡El ratoncito Pérez!
185|¿Qué le pasa a Papá Noel cuando le falta un reno?|¡Que tiene insuficiencia renal!
186|Se encontraban dos argentinos hablando|Fíjate che, Dios nació en Belén, pudiendo haberlo hecho en Buenos Aires.
187|Llaman a la puerta, abre el niño y la madre pregunta|¿Quién es? Papá Noel. Pues, si papá no es, no abras.
188|¿Qué es la Navidad?|La época en que recuperas todo el peso que perdiste en un año.
189|¿Qué es una solterona?|Una mujer que ha pasado muchas navidades pero ninguna nochebuena.
190|¡Mamá, me han robado la cazadora que me regalaron los Reyes!|Ya te dije que era de las que se llevan.
191|¿Cómo se llama el que tiene miedo a Santa Claus?|¡Claustrofóbico!
192|¡Pepa! Haz las maletas, nos ha tocado el Gordo|¿Meto la ropa de invierno o de verano? ¡Cógela toda que te vas con tu madre!
193|Mamá, ¿qué celebramos hoy?|El nacimiento del niño Jesús. ¿Pero no nació ya el año pasado?
194|¿Cómo se llaman los habitantes de Belén?|Figuritas.
195|Los Reyes me han traído un reloj|Ah, ¿qué marca? Pues la hora.
196|¿Qué te gusta más, hacer el amor o la Navidad?|Hacer el amor, pero la Navidad es más a menudo.
197|¿Qué le regaló Batman a Dora exploradora para Navidad?|Una BatiDora.
198|Mamá, si Dios nos da de comer y Santa Claus trae los regalos|¿Para qué servís papá y tú?
199|¿Qué es lo que traen todos?|Tú traes birras, tú ginebra, tú Fanta, tú algo de comer. ¿Y yo? Tú, ron. ¿De Suchard? Tú mejor no vienes.
200|¿Sabes cuál es el letrero más leído en Navidad?|NO INCLUYE PILAS.
201|¿Por qué has tirado el ordenador al agua?|¡Es que me apetecía ver cómo beben los PC's en el río!
202|Mamá, ¿sabes lo que te voy a regalar por Navidad?|Un jarrón precioso. Gracias, pero ya tenemos. No mamá, acabo de romperlo.
203|Un niño a su madre en la cena de Nochebuena|¡Mamá, mamá, qué rico está el pavo! Pues repite, hijo. ¡Mamá, mamá, qué rico está el pavo!
204|Queridos Reyes Magos, ya sé lo que quiero este año|Aprobar todo. Por favor, no confundirse como el año pasado.
205|Mamá, ¿qué le pido a los Reyes Magos?|¡Drogas! Los Reyes no traen drogas. Pero los camellos sí.
206|Hijo, espero que hayas aprendido la lección de Historia|Háblame del tercer Reich. ¿Cuál, el de la mirra?
207|Están dos perros bajo el árbol de Navidad|¡Vaya! ¡Por fin se encienden las luces del baño!
208|Dos de Lepe salen al bosque en busca de un pino|El próximo pino que veamos lo cogemos, ¡tenga o no bolas de Navidad!
209|Están dos árboles de Navidad hablando cuando se cae uno|Tronco, ¿qué te ha pasado? Nada, que se me fueron las luces.
210|¿Qué tipo de coche lleva Santa Claus?|¡Un Renol!
211|¿Por qué el mar no se seca?|Porque no tiene toalla.
212|¿Por qué los esqueletos no pelean entre ellos?|Porque no tienen agallas.
213|¿Por qué el tomate se puso rojo?|Porque vio la ensalada desnuda.
214|¿Qué hace un cero en el gimnasio?|¡Nada!
215|¿Qué hace un yogur en el gimnasio?|¡Yoga!
216|¿Qué le dice una chinche a otra chinche?|Te voy a ser chinchero, yo te quiero.
217|Se abre el telón. Se ve una isla desierta y un sobrecito de té|¿Título? La isla del té solo.
218|Papá, papá, ¿puedo ir al cine?|Sí, pero no entres.
219|¿Cuál es el colmo de un pastor?|Contar ovejas y quedarse dormido.
220|Eran 2 vacas que se pelearon|Al día siguiente no se dijeron ni mú.
